{
  "name": "High-ROI Ad Psychology & NEPQ-Based Messaging - Complete Platform Demo",
  "description": "*A Complete Online Course Demonstrating All Platform Features: Videos, Documents, Dynamic Content, Assignments & All Block Types*",
  "about": "# About This Course\n\nThis comprehensive course demonstrates **all available features** of the learning platform, including:\n\n- Multiple activity types (Video, Document, Dynamic, Assignment)\n- All block types (Text, Quiz, Images, Code, Callouts, Tables, Buttons, Badges, Flipcards, Scenarios, Math Equations, PDFs, Embedded Videos, Web Previews)\n- Various video formats (YouTube, Hosted)\n- Document types (PDF, DOC)\n- Interactive assignments\n\nPerfect for understanding the full capabilities of the platform!",
  "learnings": "Understand emotional messaging frameworks\nMaster high-converting ad scripts\nLearn product story extraction\nApply NEPQ questions for marketing\nExplore all platform features and capabilities",
  "tags": "imported, example, demo, platform-features, marketing, psychology",
  "thumbnail_query": "education technology learning platform",
  "chapters": [
    {
      "name": "MODULE 1 — Emotional Messaging Frameworks",
      "description": "Learn the fundamentals of emotional messaging and the 4 buying emotions.",
      "activities": [
        {
          "name": "Video Placeholder - YouTube",
          "description": "Introduction video hosted on YouTube",
          "type": "video",
          "video_subtype": "youtube",
          "blocks": [
            {
              "type": "text",
              "content": "```\n[VIDEO: Module 1 – Emotional Messaging Frameworks (Duration: 12:41)]\n```\n\n------"
            },
            {
              "type": "image",
              "content": {
                "url": "https://images.unsplash.com/photo-1551836022-d5d88e9218df?w=1200&auto=format&fit=crop",
                "alt": "Psychology and emotions",
                "caption": "Understanding emotional triggers in marketing",
                "alignment": "center"
              }
            },
            {
              "type": "text",
              "content": "### Transcript\n\n### **The Mind Responds to Emotion, Not Logic**\n\nPeople buy emotionally and justify logically afterwards.\n Your job as a marketer is to speak directly to the **emotion active in the buyer's mind at that moment**.\n\n### **The 4 Buying Emotions**\n\n1. **Desire** – wanting transformation\n2. **Relief** – wanting a pain to end\n3. **Fear** – avoiding mistakes or loss\n4. **Belonging** – wanting to be part of something\n\nThese four emotions drive most purchases online.\n\n------"
            }
          ],
          "video_url": "https://www.youtube.com/watch?v=dQw4w9WgXcQ"
        },
        {
          "name": "The Emotional Messaging Formula",
          "description": "Learn the core messaging formula",
          "type": "dynamic",
          "blocks": [
            {
              "type": "text",
              "content": "# The Emotional Messaging Formula\n\n```\nEmotion → Proof → Payoff\n```"
            },
            {
              "type": "image",
              "content": {
                "url": "https://images.unsplash.com/photo-1460925895917-afdab827c52f?w=1200&auto=format&fit=crop",
                "alt": "Marketing analytics dashboard",
                "caption": "Data-driven marketing insights",
                "alignment": "center"
              }
            },
            {
              "type": "callout_info",
              "content": "This formula works for all types of marketing messages, from ads to emails to landing pages."
            },
            {
              "type": "text",
              "content": "### Example\n\n- **Emotion:** \"Frustrated with ads that don't convert?\"\n- **Proof:** \"Brands using this framework increase ROAS by 30–40%.\"\n- **Payoff:** \"Spend less, earn more.\""
            },
            {
              "type": "table",
              "content": {
                "headers": ["Stage", "Purpose", "Example"],
                "rows": [
                  ["Emotion", "Create connection", "\"Frustrated with low conversions?\""],
                  ["Proof", "Build credibility", "\"30-40% ROAS increase\""],
                  ["Payoff", "Show benefit", "\"Spend less, earn more\""]
                ]
              }
            },
            {
              "type": "callout_info",
              "content": "Remember: The emotion must match the audience's current state of mind."
            },
            {
              "type": "text",
              "content": "### **The 4 Buying Emotions Quick Guide**"
            },
            {
              "type": "flipcard",
              "content": {
                "front": "Desire",
                "back": "Wanting transformation or a better future state."
              }
            },
            {
              "type": "flipcard",
              "content": {
                "front": "Relief",
                "back": "Wanting a specific pain or problem to end immediately."
              }
            },
            {
              "type": "flipcard",
              "content": {
                "front": "Fear",
                "back": "Avoiding mistakes, loss, or negative consequences."
              }
            },
            {
              "type": "flipcard",
              "content": {
                "front": "Belonging",
                "back": "Wanting to be part of a group or movement."
              }
            }
          ]
        },
        {
          "name": "Hook Library by Emotion",
          "description": "Comprehensive hook library organized by emotion",
          "type": "dynamic",
          "blocks": [
            {
              "type": "text",
              "content": "# Hook Library by Emotion"
            },
            {
              "type": "image",
              "content": {
                "url": "https://images.unsplash.com/photo-1454165804606-c3d57bc86b40?w=1200&auto=format&fit=crop",
                "alt": "Emotional connection in marketing",
                "caption": "Understanding emotions in marketing",
                "alignment": "center"
              }
            },
            {
              "type": "table",
              "content": {
                "headers": ["Emotion", "Hooks"],
                "rows": [
                  ["**Desire**", "\"If you want 3x more sales without doubling budget…\""],
                  ["**Relief**", "\"Finally, a way to fix dead ads without rebuilding everything…\""],
                  ["**Fear**", "\"Your competitors will use this before you do…\""],
                  ["**Belonging**", "\"Join thousands of marketers using this framework…\""]
                ]
              }
            },
            {
              "type": "badge",
              "content": {
                "text": "Pro Tip",
                "color": "blue"
              }
            },
            {
              "type": "text",
              "content": "Mix and match hooks based on your audience's primary emotion."
            },
            {
              "type": "quiz",
              "questions": [
                {
                  "question": "Which emotion is connected to avoiding pain?",
                  "answers": [
                    {
                      "answer": "Fear",
                      "correct": false
                    },
                    {
                      "answer": "Belonging",
                      "correct": false
                    },
                    {
                      "answer": "Desire",
                      "correct": false
                    },
                    {
                      "answer": "Relief",
                      "correct": true
                    }
                  ]
                },
                {
                  "question": "What is the correct messaging formula?",
                  "answers": [
                    {
                      "answer": "Payoff → Hook → Logic",
                      "correct": false
                    },
                    {
                      "answer": "Emotion → Proof → Payoff",
                      "correct": true
                    },
                    {
                      "answer": "Emotion → CTA → Fear",
                      "correct": false
                    },
                    {
                      "answer": "Hook → Story → CTA",
                      "correct": false
                    }
                  ]
                }
              ]
            }
          ]
        }
      ]
    },
    {
      "name": "MODULE 2 — High-Converting Ad Scripts",
      "description": "Master the art of writing scripts that convert.",
      "activities": [
        {
          "name": "Video Placeholder - Hosted",
          "description": "Hosted video example",
          "type": "video",
          "video_subtype": "hosted",
          "blocks": [
            {
              "type": "text",
              "content": "```\n[VIDEO: Module 2 – High-Converting Ad Scripts (Duration: 14:09)]\n```\n\n------"
            },
            {
              "type": "image",
              "content": {
                "url": "https://images.unsplash.com/photo-1553484771-371a605b060b?w=1200&auto=format&fit=crop",
                "alt": "Marketing and advertising concepts",
                "caption": "High-converting ad strategies",
                "alignment": "center"
              }
            },
            {
              "type": "text",